{
  "manifest_version": "drive-pilot-v1",
  "acquired_at": "2026-07-20",
  "corpus": {
    "folder_locator_sha256": "3bd464e86997cc970902af955bee9737fcc70823ae30578fc737ad65a08b3f05",
    "folder_name": "math4people",
    "owner_role": "participant_corpus_owner",
    "authorized_role": "codex_research_account"
  },
  "authorization": {
    "status": "confirmed",
    "scope": "private_research_analysis",
    "granted_on": "2026-07-20",
    "public_redistribution": false
  },
  "baseline_reconciliation": {
    "registry_rows": 83,
    "raw_files_present": 82,
    "status": "reconciled_one_missing",
    "missing_files": [
      "Erdal İnönü Moseley Çanakkale mehmet emin.ppt"
    ]
  },
  "exclusion_rules": [
    "sources_old/text/**",
    "news_raw/FGE GPT results WITHOUT sources/**",
    "news_raw/4 Suns GPT results WITH sources/**",
    "news_raw/FGE GPT results WITHOUT sources.zip",
    "news_raw/4 Suns GPT results WITH sources.zip",
    "news_raw/GPT scan 4 Suns WITHOUT sources.pdf",
    "news_raw/Person-FGE relations.pdf"
  ],
  "sources": [
    {
      "source_id": "source:v2_inonu_bilime_adanmis_bir_omur_pdf",
      "legacy_candidate_id": "source:v2_inonu_bilime_adanmis_bir_omur_pdf",
      "title": "Prof. Dr. Erdal İnönü: Bilime Adanmış Bir Ömür",
      "language": "tr",
      "scope_entity_ids": [
        "person:erdal_inonu"
      ],
      "drive": {
        "file_locator_sha256": "3692e8e2c891ca5e69a1156ece3fb3bcdb5b932c02ba3163e63b0535b435eae6",
        "parent_locator_sha256": "2a93e3cb68c8c8ad70049648a8fec1221256afca660f152206820b217aee7ac7",
        "mime_type": "application/pdf",
        "size_bytes": 3998202,
        "modified_time": "2026-07-16T15:02:31Z",
        "raw_sha256": "0ee129bbb08f5bf989804a29ced1c71c2a160949c574c9085f1ab44fb49653fb",
        "access_status": "writer_confirmed"
      },
      "origin": {
        "publisher": "Atatürk Sanat Merkezi (filename attribution; verification pending)",
        "canonical_url": null,
        "rights_status": "rights_review_required",
        "rights_url": null,
        "rights_note": "Authorized for private research from the participant-provided Drive corpus. Public quotation and redistribution remain pending source-specific review."
      },
      "analysis_status": "authorized_hash_verified",
      "extraction_status": "page_text_extracted_reviewed",
      "publication_status": "rights_review_required",
      "evidence_claims": 0,
      "relationship_claims": 0
    },
    {
      "source_id": "source:v2_inonu_barut_100_pdf",
      "legacy_candidate_id": "source:v2_inonu_barut_100_pdf",
      "title": "Kuramsal Fiziğin İki Çınarı Boğaziçi'nde Anıldı: İnönü–Barut 100",
      "language": "tr",
      "scope_entity_ids": [
        "person:erdal_inonu",
        "person:asim_orhan_barut",
        "event:2026_inonu_barut_100_anma"
      ],
      "drive": {
        "file_locator_sha256": "c92d88b8e564ed163f183a4b583dfeee98892aceac422a43c5e27c9bb6acac58",
        "parent_locator_sha256": "2a93e3cb68c8c8ad70049648a8fec1221256afca660f152206820b217aee7ac7",
        "mime_type": "application/pdf",
        "size_bytes": 6308736,
        "modified_time": "2026-07-16T15:02:34Z",
        "raw_sha256": "523536be468eb6ab96f5734998b5bca31163c1dbc529c61c3df50dca8bdfe95c",
        "access_status": "writer_confirmed"
      },
      "origin": {
        "publisher": "Boğaziçi University event-page capture (verification pending)",
        "canonical_url": null,
        "rights_status": "rights_review_required",
        "rights_url": null,
        "rights_note": "Authorized for private research from the participant-provided Drive corpus. Public quotation and redistribution remain pending source-specific review."
      },
      "analysis_status": "authorized_hash_verified",
      "extraction_status": "page_text_extracted_reviewed",
      "publication_status": "rights_review_required",
      "evidence_claims": 0,
      "relationship_claims": 0
    },
    {
      "source_id": "source:v2_ikeda_koc_life_devoted_2003_pdf",
      "legacy_candidate_id": "source:v2_ikeda_alp_eden_life_devoted_pdf",
      "title": "Professor Masatoshi Gündüz Ikeda: A Life Devoted to Mathematics",
      "language": "en",
      "scope_entity_ids": [
        "person:masatoshi_gunduz_ikeda"
      ],
      "drive": {
        "file_locator_sha256": "6217cbbc6d3848048ab5642f3cefe090c489baf0daf0161af4e6adc16c32ec73",
        "parent_locator_sha256": "38d78203709ba5fe006164f263af661631e14f7302616bc3a9ad567b3d16dc55",
        "mime_type": "application/pdf",
        "size_bytes": 2766883,
        "modified_time": "2026-01-06T11:49:58Z",
        "raw_sha256": "68680a0fa12b6e7f6aaff5f8201b7b4fb416161a07a973f9cf82f7a885708764",
        "access_status": "writer_confirmed"
      },
      "origin": {
        "publisher": "TÜBİTAK Turkish Journal of Mathematics",
        "canonical_url": "https://journals.tubitak.gov.tr/math/vol27/iss4/1/",
        "rights_status": "cc_by_4_0",
        "rights_url": "https://journals.tubitak.gov.tr/math/openaccess.html",
        "rights_note": "The PDF text identifies Cemal Koç's 2003 journal article. The journal states CC BY 4.0 terms; attribution and exact publisher-byte reconciliation are required before excerpt publication."
      },
      "analysis_status": "authorized_hash_verified",
      "extraction_status": "page_text_extracted_reviewed",
      "publication_status": "license_verified",
      "evidence_claims": 0,
      "relationship_claims": 0
    },
    {
      "source_id": "source:v2_ikeda_matematik_dunyasi_2003_pdf",
      "legacy_candidate_id": "source:v2_ikeda_matematik_dunyasi_2003_pdf",
      "title": "Masatoshi Gündüz İkeda (1926–2003)",
      "language": "tr",
      "scope_entity_ids": [
        "person:masatoshi_gunduz_ikeda"
      ],
      "drive": {
        "file_locator_sha256": "5a4c7416d330bba47fbebe7f00feeb18f9e57f9afaa7497902e03e1b453e795a",
        "parent_locator_sha256": "38d78203709ba5fe006164f263af661631e14f7302616bc3a9ad567b3d16dc55",
        "mime_type": "application/pdf",
        "size_bytes": 239377,
        "modified_time": "2026-01-06T11:50:48Z",
        "raw_sha256": "4ed5ace3214cc8b3ef2aaff809ff44a64ea4c7b7ab7ba9e4dc1f45f515f126ca",
        "access_status": "writer_confirmed"
      },
      "origin": {
        "publisher": "Matematik Dünyası, 2003 Kış",
        "canonical_url": null,
        "rights_status": "rights_review_required",
        "rights_url": null,
        "rights_note": "Authorized for private research from the participant-provided Drive corpus. Public quotation and redistribution remain pending source-specific review."
      },
      "analysis_status": "authorized_hash_verified",
      "extraction_status": "page_text_extracted_reviewed",
      "publication_status": "rights_review_required",
      "evidence_claims": 0,
      "relationship_claims": 0
    },
    {
      "source_id": "source:v2_inonu_invited_speakers_pdf",
      "legacy_candidate_id": "source:v2_inonu_invited_speakers_pdf",
      "title": "Regional Conference on Mathematical Physics IX: Invited Speakers",
      "language": "en",
      "scope_entity_ids": [
        "person:erdal_inonu",
        "institute:feza_gursey_enstitusu"
      ],
      "drive": {
        "file_locator_sha256": "cb1e80ce1a85c33e7590280f259e3ed4cb7366d72a0ad8ded39e4c85d6aa9786",
        "parent_locator_sha256": "6525ff88f6709011d062c33e100a305592ea98fdb7b3267b7c6469dd30fe0bb3",
        "mime_type": "application/pdf",
        "size_bytes": 15358,
        "modified_time": "2026-07-11T16:01:14Z",
        "raw_sha256": "20bfea4bf372e0bac41d19c50c6d7e2cc6d5fe89123888f8c9c8b9d1f526086e",
        "access_status": "writer_confirmed"
      },
      "origin": {
        "publisher": "Feza Gürsey Institute web capture via the Internet Archive",
        "canonical_url": null,
        "rights_status": "rights_review_required",
        "rights_url": null,
        "rights_note": "Authorized for private research from the participant-provided Drive corpus. The archived page and reuse terms must be reconciled before public quotation."
      },
      "analysis_status": "authorized_hash_verified",
      "extraction_status": "page_text_extracted_reviewed",
      "publication_status": "rights_review_required",
      "evidence_claims": 0,
      "relationship_claims": 0
    },
    {
      "source_id": "source:v2_fge_history_people_pdf",
      "legacy_candidate_id": "source:v2_fge_history_people_pdf",
      "title": "History of the Feza Gürsey Institute: People",
      "language": "en",
      "scope_entity_ids": [
        "institute:feza_gursey_enstitusu"
      ],
      "drive": {
        "file_locator_sha256": "a0dfa29c8e078819e18d83b04c5e0ee890452fd1dbf53e102c6a4ef0622fa9e2",
        "parent_locator_sha256": "7334db1dcadaa8d041b23ac995c5e233fe0c5e5037e5883468a59a21e8f6749c",
        "mime_type": "application/pdf",
        "size_bytes": 382952,
        "modified_time": "2026-07-11T15:54:34Z",
        "raw_sha256": "fa6f21b8a9ada5e6af8aee46a3d2199b271363916bd8b284e0c445600ae0c12d",
        "access_status": "writer_confirmed"
      },
      "origin": {
        "publisher": "History of the Feza Gürsey Institute web capture",
        "canonical_url": null,
        "rights_status": "rights_review_required",
        "rights_url": null,
        "rights_note": "Authorized for private research from the participant-provided Drive corpus. Public quotation and redistribution remain pending source-specific review."
      },
      "analysis_status": "authorized_hash_verified",
      "extraction_status": "page_text_extracted_reviewed",
      "publication_status": "rights_review_required",
      "evidence_claims": 0,
      "relationship_claims": 0
    },
    {
      "source_id": "source:v2_fge_history_seminars_pdf",
      "legacy_candidate_id": "source:v2_fge_history_seminars_pdf",
      "title": "History of the Feza Gürsey Institute: Seminars",
      "language": "en",
      "scope_entity_ids": [